{
  "algorithm": {
    "description": "For each ASCII arm name, compute unsigned FNV-1a-64 over UTF-8(seed + NUL + block_id + NUL + arm), sort by ascending unsigned integer and break a hash tie by ascending ASCII arm name.",
    "id": "fnv1a64_utf8_ascending_v1",
    "offset_basis_decimal": "14695981039346656037",
    "prime_decimal": "1099511628211"
  },
  "block_count": 60,
  "blocks": [
    {
      "block_id": "primary-001",
      "kind": "primary",
      "lineage_id": "train_closed",
      "partition": "train",
      "repetition": 1,
      "replacement_index": 0,
      "stratum": "closed_pack",
      "task_id": "train_closed",
      "units": [
        {
          "arm": "ordinary",
          "assigned_order": 1,
          "assignment_id": "assignment-primary-001-ordinary",
          "scheduled_unit_id": "unit-primary-001-01"
        },
        {
          "arm": "symbol_only",
          "assigned_order": 2,
          "assignment_id": "assignment-primary-001-symbol_only",
          "scheduled_unit_id": "unit-primary-001-02"
        },
        {
          "arm": "adaptive_only",
          "assigned_order": 3,
          "assignment_id": "assignment-primary-001-adaptive_only",
          "scheduled_unit_id": "unit-primary-001-03"
        },
        {
          "arm": "combined",
          "assigned_order": 4,
          "assignment_id": "assignment-primary-001-combined",
          "scheduled_unit_id": "unit-primary-001-04"
        }
      ]
    },
    {
      "block_id": "primary-002",
      "kind": "primary",
      "lineage_id": "train_graph",
      "partition": "train",
      "repetition": 1,
      "replacement_index": 0,
      "stratum": "realistic_fallback",
      "task_id": "train_graph",
      "units": [
        {
          "arm": "combined",
          "assigned_order": 1,
          "assignment_id": "assignment-primary-002-combined",
          "scheduled_unit_id": "unit-primary-002-01"
        },
        {
          "arm": "ordinary",
          "assigned_order": 2,
          "assignment_id": "assignment-primary-002-ordinary",
          "scheduled_unit_id": "unit-primary-002-02"
        },
        {
          "arm": "adaptive_only",
          "assigned_order": 3,
          "assignment_id": "assignment-primary-002-adaptive_only",
          "scheduled_unit_id": "unit-primary-002-03"
        },
        {
          "arm": "symbol_only",
          "assigned_order": 4,
          "assignment_id": "assignment-primary-002-symbol_only",
          "scheduled_unit_id": "unit-primary-002-04"
        }
      ]
    },
    {
      "block_id": "primary-003",
      "kind": "primary",
      "lineage_id": "calibration_closed",
      "partition": "calibration",
      "repetition": 1,
      "replacement_index": 0,
      "stratum": "closed_pack",
      "task_id": "calibration_closed",
      "units": [
        {
          "arm": "combined",
          "assigned_order": 1,
          "assignment_id": "assignment-primary-003-combined",
          "scheduled_unit_id": "unit-primary-003-01"
        },
        {
          "arm": "ordinary",
          "assigned_order": 2,
          "assignment_id": "assignment-primary-003-ordinary",
          "scheduled_unit_id": "unit-primary-003-02"
        },
        {
          "arm": "symbol_only",
          "assigned_order": 3,
          "assignment_id": "assignment-primary-003-symbol_only",
          "scheduled_unit_id": "unit-primary-003-03"
        },
        {
          "arm": "adaptive_only",
          "assigned_order": 4,
          "assignment_id": "assignment-primary-003-adaptive_only",
          "scheduled_unit_id": "unit-primary-003-04"
        }
      ]
    },
    {
      "block_id": "primary-004",
      "kind": "primary",
      "lineage_id": "calibration_graph",
      "partition": "calibration",
      "repetition": 1,
      "replacement_index": 0,
      "stratum": "realistic_fallback",
      "task_id": "calibration_graph",
      "units": [
        {
          "arm": "ordinary",
          "assigned_order": 1,
          "assignment_id": "assignment-primary-004-ordinary",
          "scheduled_unit_id": "unit-primary-004-01"
        },
        {
          "arm": "combined",
          "assigned_order": 2,
          "assignment_id": "assignment-primary-004-combined",
          "scheduled_unit_id": "unit-primary-004-02"
        },
        {
          "arm": "symbol_only",
          "assigned_order": 3,
          "assignment_id": "assignment-primary-004-symbol_only",
          "scheduled_unit_id": "unit-primary-004-03"
        },
        {
          "arm": "adaptive_only",
          "assigned_order": 4,
          "assignment_id": "assignment-primary-004-adaptive_only",
          "scheduled_unit_id": "unit-primary-004-04"
        }
      ]
    },
    {
      "block_id": "primary-005",
      "kind": "primary",
      "lineage_id": "evaluation_closed",
      "partition": "evaluation",
      "repetition": 1,
      "replacement_index": 0,
      "stratum": "closed_pack",
      "task_id": "evaluation_closed",
      "units": [
        {
          "arm": "ordinary",
          "assigned_order": 1,
          "assignment_id": "assignment-primary-005-ordinary",
          "scheduled_unit_id": "unit-primary-005-01"
        },
        {
          "arm": "combined",
          "assigned_order": 2,
          "assignment_id": "assignment-primary-005-combined",
          "scheduled_unit_id": "unit-primary-005-02"
        },
        {
          "arm": "symbol_only",
          "assigned_order": 3,
          "assignment_id": "assignment-primary-005-symbol_only",
          "scheduled_unit_id": "unit-primary-005-03"
        },
        {
          "arm": "adaptive_only",
          "assigned_order": 4,
          "assignment_id": "assignment-primary-005-adaptive_only",
          "scheduled_unit_id": "unit-primary-005-04"
        }
      ]
    },
    {
      "block_id": "primary-006",
      "kind": "primary",
      "lineage_id": "evaluation_graph",
      "partition": "evaluation",
      "repetition": 1,
      "replacement_index": 0,
      "stratum": "realistic_fallback",
      "task_id": "evaluation_graph",
      "units": [
        {
          "arm": "adaptive_only",
          "assigned_order": 1,
          "assignment_id": "assignment-primary-006-adaptive_only",
          "scheduled_unit_id": "unit-primary-006-01"
        },
        {
          "arm": "symbol_only",
          "assigned_order": 2,
          "assignment_id": "assignment-primary-006-symbol_only",
          "scheduled_unit_id": "unit-primary-006-02"
        },
        {
          "arm": "combined",
          "assigned_order": 3,
          "assignment_id": "assignment-primary-006-combined",
          "scheduled_unit_id": "unit-primary-006-03"
        },
        {
          "arm": "ordinary",
          "assigned_order": 4,
          "assignment_id": "assignment-primary-006-ordinary",
          "scheduled_unit_id": "unit-primary-006-04"
        }
      ]
    },
    {
      "block_id": "primary-007",
      "kind": "primary",
      "lineage_id": "train_closed",
      "partition": "train",
      "repetition": 2,
      "replacement_index": 0,
      "stratum": "closed_pack",
      "task_id": "train_closed",
      "units": [
        {
          "arm": "ordinary",
          "assigned_order": 1,
          "assignment_id": "assignment-primary-007-ordinary",
          "scheduled_unit_id": "unit-primary-007-01"
        },
        {
          "arm": "symbol_only",
          "assigned_order": 2,
          "assignment_id": "assignment-primary-007-symbol_only",
          "scheduled_unit_id": "unit-primary-007-02"
        },
        {
          "arm": "adaptive_only",
          "assigned_order": 3,
          "assignment_id": "assignment-primary-007-adaptive_only",
          "scheduled_unit_id": "unit-primary-007-03"
        },
        {
          "arm": "combined",
          "assigned_order": 4,
          "assignment_id": "assignment-primary-007-combined",
          "scheduled_unit_id": "unit-primary-007-04"
        }
      ]
    },
    {
      "block_id": "primary-008",
      "kind": "primary",
      "lineage_id": "train_graph",
      "partition": "train",
      "repetition": 2,
      "replacement_index": 0,
      "stratum": "realistic_fallback",
      "task_id": "train_graph",
      "units": [
        {
          "arm": "combined",
          "assigned_order": 1,
          "assignment_id": "assignment-primary-008-combined",
          "scheduled_unit_id": "unit-primary-008-01"
        },
        {
          "arm": "symbol_only",
          "assigned_order": 2,
          "assignment_id": "assignment-primary-008-symbol_only",
          "scheduled_unit_id": "unit-primary-008-02"
        },
        {
          "arm": "adaptive_only",
          "assigned_order": 3,
          "assignment_id": "assignment-primary-008-adaptive_only",
          "scheduled_unit_id": "unit-primary-008-03"
        },
        {
          "arm": "ordinary",
          "assigned_order": 4,
          "assignment_id": "assignment-primary-008-ordinary",
          "scheduled_unit_id": "unit-primary-008-04"
        }
      ]
    },
    {
      "block_id": "primary-009",
      "kind": "primary",
      "lineage_id": "calibration_closed",
      "partition": "calibration",
      "repetition": 2,
      "replacement_index": 0,
      "stratum": "closed_pack",
      "task_id": "calibration_closed",
      "units": [
        {
          "arm": "ordinary",
          "assigned_order": 1,
          "assignment_id": "assignment-primary-009-ordinary",
          "scheduled_unit_id": "unit-primary-009-01"
        },
        {
          "arm": "symbol_only",
          "assigned_order": 2,
          "assignment_id": "assignment-primary-009-symbol_only",
          "scheduled_unit_id": "unit-primary-009-02"
        },
        {
          "arm": "adaptive_only",
          "assigned_order": 3,
          "assignment_id": "assignment-primary-009-adaptive_only",
          "scheduled_unit_id": "unit-primary-009-03"
        },
        {